% Earned,Criterion 1 Feedback,Criterion 2 Feedback
100,Steps to completion were perfectly followed ,Assignment submitted on time
>85,Steps to completion were adequately followed. More attention to detail is needed.,
>75,"Steps to completion were partially followed. Some steps not followed, preventing the assignment's completion.",
>25,Steps to completion were attempted without avail. Allow more time to complete the assignment or consider asking instructor for clarification before due date.,
>0,"Steps to completion were not attempted, no credit for assignment earned.",Assignment not submitted on time